{
  "decision_id": "D-000003",
  "finding_id": "OBJ-TYUMENSKAYA-5-GOLD-SEED-IOS4-078-PDRD-140",
  "finding_group_id": "OBJ-TYUMENSKAYA-5-GOLD-SEED-G-IOS4-078-MISS-01",
  "object_id": "OBJ-TYUMENSKAYA-5-GOLD-SEED",
  "run_id": "m1-tyumen-e2e",
  "decided_by": "inspector-01",
  "decided_role": "INSPECTOR",
  "decided_at": "2026-10-01T10:00:00Z",
  "decision": "CLARIFICATION_REQUIRED",
  "effective_status": "CLARIFICATION_REQUIRED",
  "clarify_code": "AWAITING_APPROVAL_CHECK",
  "comment": "Требуется проверка согласования изменения с экспертизой.",
  "comment_source": "MANUAL",
  "gold_effect": "NONE"
}
